source_id,source_name,source_type,last_checked_date,publication_or_notice_date,fieldwork_start_date,fieldwork_end_date,sample_size,collection_method,quota_method,notes,source_url
wikipedia_fr_2027_polls,Wikipedia FR 2027 polls,wikipedia,2026-05-30,,,,"",unknown,unknown,Page de référence publique en français sur les sondages 2027; utilisée pour le suivi des tableaux les plus récents.,https://fr.wikipedia.org/wiki/Liste_de_sondages_sur_l%27%C3%A9lection_pr%C3%A9sidentielle_fran%C3%A7aise_de_2027
wikipedia_en_2027_polls,Wikipedia EN 2027 polls,wikipedia,2026-05-30,,,,"",unknown,unknown,Page de référence publique en anglais sur les sondages 2027; utile pour recouper les tableaux et scénarios.,https://en.wikipedia.org/wiki/Opinion_polling_for_the_2027_French_presidential_election
commission_notice_harris_march_2026,Toluna Harris Interactive pour M6 et RTL,official_notice,2026-05-30,2026-03,2026-03-22,2026-03-22,1000,online,true,Notice technique officielle consultée via la Commission des sondages; marges d'erreur annoncées entre 1.8 et 3.8 points.,https://www.commission-des-sondages.fr/notices/medias/fichiers/add/2165
ifop_figaro_feb_2026,Ifop-Fiducial pour Sud Radio et Le Figaro,public_poll_page,2026-05-30,2026-02,2026-02-26,2026-02-27,"",online,unknown,Page publique Ifop repérée en ligne; à enrichir par notice technique avant intégration fine au dataset.,https://www.ifop.com/article/les-intentions-de-vote-dans-la-perspective-de-la-prochaine-election-presidentielle-2
commission_communication_april_2026,Commission des sondages - communication avril 2026,official_communication,2026-05-30,2026-04-15,,,,"",unknown,unknown,La Commission indique qu'à compter du 15 avril 2026 les enquêtes de popularité et de notoriété publiées entrent dans le champ du débat électoral à venir.,https://www.commission-des-sondages.fr/hist/communiques/index.htm
